{
  "version": "1.0.0",
  "policyNamespace": "fintech.enterprise.guardrails",
  "description": "Deterministic invariants enforcing financial risk boundaries, transaction ceilings, and dual-custody thresholds",
  "defaultEffect": "DENY",
  "rules": [
    {
      "id": "FIN-000-DENY-NON-POSITIVE-AMOUNT",
      "name": "Prohibit Non-Positive Transfer Amounts",
      "description": "Transfers with negative, zero, or non-finite amounts are strictly forbidden.",
      "targetTools": ["transfer_funds", "wire_money", "create_payout"],
      "effect": "DENY",
      "priority": 1100,
      "conditions": [
        {
          "field": "parameters.amount",
          "operator": "LESS_THAN_OR_EQUAL",
          "value": 0,
          "description": "Transfer amount must be strictly greater than zero"
        }
      ]
    },
    {
      "id": "FIN-001-BLOCK-UNAUTHORIZED-CURRENCY",
      "name": "Enforce Permitted Operating Currencies",
      "description": "Restricts transactions to authorized sovereign fiat currencies",
      "targetTools": ["transfer_funds", "wire_money", "create_payout"],
      "effect": "DENY",
      "priority": 1000,
      "conditions": [
        {
          "field": "parameters.currency",
          "operator": "NOT_IN",
          "value": ["USD", "EUR", "GBP", "INR", "SGD"],
          "description": "Currency is not in the approved whitelist of corporate operating currencies"
        }
      ]
    },
    {
      "id": "FIN-002-BLOCK-ADMIN-CREDIT-ALTERATION",
      "name": "Block Autonomous Line of Credit Adjustments",
      "description": "Agents cannot modify customer credit ceilings or overdraft protection limits autonomously",
      "targetTools": ["adjust_credit_limit", "modify_overdraft", "forgive_debt"],
      "effect": "DENY",
      "priority": 950,
      "conditions": [
        {
          "field": "agent.role",
          "operator": "NOT_EQUALS",
          "value": "credit-risk-committee-chair",
          "description": "Only credit risk committee executive can authorize credit limit alterations"
        }
      ]
    },
    {
      "id": "FIN-003-ESCALATE-DUAL-CUSTODY-THRESHOLD",
      "name": "Enforce Dual-Custody HITL Escalation for Transfers > $25,000",
      "description": "Transfers exceeding $25,000 must be approved by an authorized financial controller",
      "targetTools": ["transfer_funds", "wire_money"],
      "effect": "ESCALATE",
      "priority": 850,
      "conditions": [
        {
          "field": "parameters.amount",
          "operator": "GREATER_THAN",
          "value": 25000,
          "description": "Transfer amount exceeds single-agent ceiling ($25,000); requires Dual-Officer signoff"
        }
      ]
    },
    {
      "id": "FIN-004-ALLOW-STANDARD-TRANSFER",
      "name": "Permit Autonomous Transfers Under $25,000",
      "description": "Permits standard payments up to $25,000 within authorized currency bounds",
      "targetTools": ["transfer_funds"],
      "effect": "ALLOW",
      "priority": 200,
      "conditions": [
        {
          "field": "parameters.amount",
          "operator": "LESS_THAN_OR_EQUAL",
          "value": 25000,
          "description": "Transfer is within single-agent authorized limit"
        },
        {
          "field": "parameters.amount",
          "operator": "GREATER_THAN",
          "value": 0,
          "description": "Transfer amount must be positive"
        }
      ]
    },
    {
      "id": "FIN-005-ALLOW-READONLY-QUERIES",
      "name": "Allow Read-Only Account Inquiries",
      "description": "Permits ledger inquiries, account balances, and transaction history reads",
      "targetTools": ["check_balance", "get_account_statement", "list_transactions"],
      "effect": "ALLOW",
      "priority": 100,
      "conditions": []
    }
  ]
}
